ID,Text_Input
1,I was at work and I asked my supervisor what to do about a particular problem.  She said not to worry about it and we'd get to it later.  I then got chewed out by the boss because I left the problem unfixed.  I felt bad because I should have stuck up for yself.  I just let that girl throw me under the bus and I didn't say anything.  I wish I would've done things differently and stood up for myself more because I let her dictate my reputation and that wasn't fair.  My boss doesn't always care what my opinins are.  I don't like that he has so many other political considerations to think about.
2,"We have a great relationship. Whenever I need help with anything I can rely on his knowledge and expertise to help me out. He is available on call at any time. He shows me respect by letting me have freedom and autonomy. In other words he trusts me and dos not micromanage. My relationship with him is similar to others in that we trust him and he trusts us. His door is always open to all of us. I am a personable and sociable type of person so maybe I am a bit closer to him than others just because I am goo at small talk and chit chat. But thinking about it, I have been there over 6 years and never even had a cross word with him. It is a very professional relationship in that sense but there is also a personal aspect to it as well in that we all look up to im and he treats us with respect."
3,"I almost never speak with him. he does not know what i do and couldn't give me any coaching if he tried. but thankfully, he does not even try. My relationship with him is the same as with my previous manager - it is virtually nonexistent. That means that e barely ever interact other than at company holiday parties. I am basically on my own left to do what i think is best for my department and in my area using my skill set and experience. I guess I still have to come up with some more words to hit the minium lol. wow and now i got an error saying that this response must be at least 600 characters. you are joking - this is for one measly dollar? not enough money to justify this level of work."
4,"At work, my manager provides me with a great deal of coaching. Given that this was my first job, my manager really took me under his wing and showed me what I should be doing to succeed in my role at this company. He has always been kind and receptive to y needs as an employee. If I ever go above and beyond in a task, he always makes note of it and finds a way to somehow give back to me. This is not limited to me either. He has been treating all of his employees in this manner for years."
5,"Productive, respectful relationships between a boss and his or her employees is key to any company’s success. While the boss’ top priority is likely to have hardworking employees who fulfill his vision for the company, it’s a safe bet that he’d alo like to have more than superficial relationships with the people he works with every day. After all, he probably spends more time with his staff than he does with anyone else. There have been a number of times that I’ve shared ideas with employees, an they’ve come back and suggested—politely of course—that my idea may not be the best route. The reason I don’t get upset is because, along with the rejection of my idea, they present a suggestion for something else. Or, better still, they considerhow they can adapt my idea and make it work more effectively."
6,"  I am proved as much coaching and development that I feel that I need.  This is discussed at my Goals and objective meetings.  Basically whatever I feel I need will be provided for me.  My leader behaves in a way that I believe that she respects me.  Shealways listens to my ideas, and to my discussions that I have during meeting..  All of us in the dept. feel the same way toward my manger, she is the best.  This shows in all of our attitudes and our perfromance through out the company.  We are a very tigt group.  We have the attitude that what happens to one of us happens to all of us.  Working as a team is our main focus and is emphasized in everything that we do."
7,Currently the leader of my organization does not provide much coaching to myself as I our job duties are very much separate but benefit the same situations. He respects me by giving me things to accomplish that are difficult and sensitive showing that he rusts my work and believe in my abilities to accomplish tasks. My relationship with  my leader is different from co-workers because my job duties differ from the other ones. I have a specific portion of the business that I am in charge of and no one else s a support staff. Thus my leader and I work closer together on projects and tasks. We are very involved and my work directly affects his ability to do his work
8,I only see the Leader of my company every few months. She is good at telling us what we need to work on though at our quarterly meetings.  If we need remediation she communicates through phone or email to help us. She is friendly and unless you call off o do somthing really bad at work she will then be meaner. I had a friend who worked for the same place and my leader was not as kind to her.  But she had a lot of babysitting issues or very bad clients.  The leader wasn't able to work with her and she quit
9,It's not a great working relationship. We both work in a kitchen together as part owners and we tend to get very angry and frustrated with each other...as people tend to do when they're working in close confines and in stressful situations.
10,I have a positive relationshup with my work leader. He is always providing feedback on my teaching. He respects me because he always breaks down my areas of strength and my areas of weakness without making me feel worthless. I am constantly emailing him o speaking to him about what is happening in my classroom and what his opinion are. I believe i have a similar relationship that most of my coworkers have with him because our boss is very personable and friendly. He wantes the best for everoyne and his acions speak for themselves. he is a great boss. His performance is what drives us to be better leaders in our schools and teachers.
11,"My manager doesn't care about anyone but himself. He's selfish and doesn't pay any attention to lower level employees. He has no respect for anyone. He's discriminated against me and he's started rumors about me and other employees because I am gay and hesaw me as a threat because I spoke up to his higher ups about him harassing me. He was constantly watching my every move, telling me I couldn't do something even though other employees did them, my time stamps were being watched as well as when I left to o to lunch like who I left with and where I went. There is no coaching. I had to find out everything on my own. When he's ever presented with an issue in front of customers because lower level is confused or something gets jammed up, he has no idea what h's doing. So no. He's incapable of coaching."
12,"I respect there imput and look to them to be inspired. They have taught me most of what I know. I look to them when I have questions. He is alwyas there for when when I feel unsure of my purpose and where I should be going from here. I have never had a bos like him that care so much about my future. He looks in on what I am up too and helps me see a clearer path when I feel lost. He makes me feel valued as a team member, but just someone who was hired to do a job then forget about it."
13,"My supervisor was a bit strangely acting when I first started working under him. After about 2-3 months under him, we created a good working relationship that benefited both of us mutually at work.

He recognizes everyone's effort and appreciates whatevereffort we make to complete or showcase out talent at work. He behaves in a good manner even when met outside the work.

Regarding the relationship with other co-workers, he is fair among out group at least. He shares all work related materials and inputs ithin the team and expects all of us to put in our share of the work when working on a group project."
14,"With my job it is very independent, there is not a lot of interaction with the managers. Their are nice training sessions that I can attend to learn more or get clarity. I can also email my managers for help and assistance or concerns. I believe that the esponse to my concerns shows that my manager respects me. Most of those I work with have the same experience with the managers that I have. We are independent contractors so a lot of happenings are just between, me, myself, and I. However, there is a leadrship ladder, and high ups that i can consult when I need to. 

There is not a lot of interaction because this is a contract work, and it is a work from home position. so therefore access to people in general is limited. Hoiwever I do not feel alone in th lease. I feel the company has done a wonderful job in making sure I feel supported and like they are there when we need them. There are perks and drawbacks to working remotely."
15,"I think I have a great relationship with my leader; she is open with me and the coworkers on my team about company issues and goals.  I would say that my relationship is comparable to others on the team; we get along great, and she is always available to iscuss any issues I am having with my workload.  She provides coaching when we ask for it, but she is always will to send us off for training that will help us do our jobs better.  She does have the exact technical skill set needed to do a lot of our work so we must seek outside help at times.  She always stands behind our work and treats us with respect."
16,"The relationship that I have with my leader is a great one. We understand each other's goals and dreams and no that working in unison will help us both achieve what the other wants to do. When I am stuck in a rut, this person knows how to get me out of itand it works the other way. My leader also gives me the freedom to do what I need to do within the confines of my employ and that shows the kind of respect he has for me by letting me on the longer leash. This mutual respect helps strengthen what we did ad makes us a better team. This also fosters a work environment that people admire and look to when developing their team and the needs of their team."
17,"She and I have a very strong two way relationship.  She trusts me to run her restaurant, and I do my best to put my skills and training to use.  We bounce ideas off of one another and make the best of the situation.  We have each others backs and support ne another no matter what.  If I have a problem, I can go to her with it.  If she has something she needs to get off of her chest, she can talk to me and work it out.  We both know what we need to do to make this place run well.  We just really work well ogether and it has taken years to cultivate this relationship.  I feel like I am a family member at this place of work."
18,"My leader is a true representative with great leadership qualities. 
1) He helps in every way possible, if we have doubts regarding project or anything. He has vast knowledge in the area and thus help us with the same.
2) He is always polite and professioal while communicating with fellow members of the organization. He does not insult or make fun of any co-worker in front of an audience.
3) I think it is more or less same as my co-workers. My manager doesn't really discriminate between people of differen backgrounds or different departments. He has a good behavior towards each and every individual as a person."
19,"He give positive advice ,he behave show me very much respect,I have good relationship with my manager because if i done some error he care me and solve that error and problem also teach me how to do solve this also my leader gives advice how to do furtherand how to handle those errors with very calm ,also my leader shares the experience with me for positive attitude also share personal experience with me so that we have good relationship like friend ,i am very luck to have the great leader ,also have verymuch proud to this great leader

Some advice from my leader
A team leader should be a role model to his team members. He should treat each and every individual as one and avoid partiality at work Do not give anyone a special treatment just because he drop your son to school every day or says a yes to whatever you say. Appreciate if someone has done exceptionally well but do make sure to correct him if he is wrong somewhere. The team leader should not be rude or harsh to anyone. There is a correct way for verything and one should not insult any team member. It is strictly unethical. Sit with him and make him realize his mistakes. He would definitely look up to you in future.

The superior must not act pricy and should always be accessible to his employees.The individuals must have the liberty to walk up to their immediate bosses in case of a doubt and clear things. The hierarchy should not be too complicated as it leads to confusions and disputes among employees.

The manager must ensure that all importantcommunication takes place on an open forum for everyone to get a common picture. Problems arise when communication is done on a one to one basis. Call everyone together so that all the members are clear as to what is expected out of them and what their coleagues are up to. Communication should be transparent for an effective employee relation. Any employee should not feel neglected or left out. If the team leader wants to pass on any information to his team m"
20,"My leader is a good and helpful person. He always have time for me to make me understand things. He gives me a theoretical ex poser of what I am going to do and let me do the practical work for myself, so that I can learn and understand the problems and ticks behind a field work. He always pays attention when I tell him my ideas. Even when my ideas are bogus, he don't insult me. He tries to modify or reassess my ideas and polish it to be a good one, He behaves with all the employee in a friendly and helpfl manners and takes care of everyone. He made such an environment in the workplace that our intellectual can flourish without a hitch."
21,My Rm is not at all interested in the performance of an individual. He only prefer those who are political and threat for my rm in a job prospects . Because if he care those people then his job will be secure otherwise those political person will form a goup and go against the rm and throw the rm out of the company by creating fake allegations. He will not at all listen to anyone who behave good with him. He should be threatened in the one on one and should be scared for his job. Then only he take care ofhis team member. I He will not at all listen to anyone who behave good with him. He should be threatened in the one on one and should be scared for his job. Then only he take care of his team memberhate such type of team leader who are such scared of the ssociates. He should be brave enough to handle tough situations.
22,"my manager is smart and well educated, like me he also started at the bottom and now at the top,  he likes to see himself as a role model at work and he really encourages people to come up with different solutions and really encourages out of the box thining.  He will be watching but will let you have your way.  He has no tolerance to unsafe workers, safety in the work place comes first and rules are there to be followed,  He also ensures that none of us are over worked or  given extra responsibility wher there is some one else free and available to do that job.  Plus he constantly monitors each of his staff and tell them whats wrong or what is right"
23,"My leader,a respectable lady with years of experience,have personal relationship with everyone of the staff.In the 50 plus staffs,she keeps a special relation with me, I am also considers her as my true boss; for  the respect and considerations she gives e. She is always  by my side in case of new training program and put my first in all her priorities( of whom she considers as loyal subordinates).Even though she is 5 years older to me,she always treat me as her elder brother and behaves like with such  rspect.And I ,on my part,considers her  not as my supervisor,but my elder sister.She is friendly with all by co workers,but always put me first in anything connected with work."
24,My working relationship with my leader is really good. He helps me in everything. He supports me to a great extent. I am someone really special to him. He gave me a really good coaching and development to enhance my career and my organisation. He tries toset my personal goals along with sets and sides of the goals and purposes of goals of the organisation. My manager always respects me to a great extend. As compared to my co- workers relationship it is really good and great. The relationship is valued andto a great extend it is good. I enjoy this relationship and I want to be in this kind of relation with my leader.
25,"1. I do not get any coaching and development by my leader. I have never told what to do and the project were done by the worker but the name goes to the manager.
2. He shows the respect externally and in front but considering his behavior with others, I d not think its from heart. I think its for self accomplishment. It is just going professional and nothing more friendly type. I am not allowed to think on my perspectives. I should do only what he had told to do. I do not have independence to work on my on ideas. He does not provide resources even though he gets it from our organization. 
3. My relationship with my leader is good in behavior and some support for fresh innovative ideas. But neither me nor others do not trust our leader in revealing our ides."
26,"When I first started at my company, my leader gave me a fair amount of coaching, but after a few months, he stopped doing that and I was left to figure out things on my own.  He doesn't show me much respect, one example is I haven't had a desk or a cubicl or drawer or closet in one place in all my time at the company. Almost every day he sticks meet at a different work location, some of which are crowded and noisy and dark.  I cannot help but perceive that many of my coworkers have a much better relationsip with my boss than I do. And I'm sorry to say that I believe the reason why is that both my boss and most of my coworkers are Hispanic, and I am not."
27,"My manager give me totally freedom to do business in my own way he only tell me target , and whenever I achieve my target my manager give nature smile and salute me. My manager is good man he maintain good relation with all works. He is believe in work bu not in pressure , he believes pressure free environment creat positive effect in work place also in workers behaviour . whenever position is not positive my manager control his mind and always try to be positiv and that thing give us straight to work , w have good relation we are work like family ,This thing creat tension free work environment and creat really positive effect in work."
28,"I was just a newbie when I joined this company and my manager offered the essential time to learn the basics of the field. He never discouraged me for my mistakes. Infact, he played the role of the trainer at times. 
For three months, I was just learning he basics. He never pushed me to make things in a rush. The patient and interest has showered in that period of time was invaluable. 
All the credit goes to my leader as I'm being the top most personality in my field now. He never committed himself to comare my achievements with others. 

I was just a newbie when I joined this company and my manager offered the essential time to learn the basics of the field. He never discouraged me for my mistakes. Infact, he played the role of the trainer at times. 
Forthree months, I was just learning the basics. He never pushed me to make things in a rush. The patient and interest has showered in that period of time was invaluable. 
All the credit goes to my leader as I'm being the top most personality in my field now He never committed himself to compare my achievements with others."
29,my boss goes the extra mile to make sure that we have basic knowledge and up to date training on the most current devices and products. I think he does very well in promoting great attitudes and to keep a strong motivated sense of happiness in and maongstour colleauges. I am happy with his professional approach to the way we a;ll inteeract with one another as well. he goes above and beyond the call of duty to make sure that everything is done and that everyone accomplishises their goals in a times fasion nd that the product quota is met. i have a great deep sense of respect for him as he does this and has a great smile on his face as well
30,"My leader offers very little coaching and development.  This is because she does not know herself.  I know more about the job than she does.  She occasionally shows that she respects me by greetings, listening and using my suggestions.  However, sometimesshe doesn't what she wants anyway which never has a good outcome.  I have a better relationship with my leader than my co-workers since I am her assistant.  I feel she does not respect my co-workers and acts in passive aggressive ways to most of them.  A ouple of them intimidate her and she does not correct them, but goes out of her way to correct those she can intimidate."
31,"We have a great manager.  She is always showing us how to do our work more efficiently, with less stress on us.  She behaves in a very professional manner, but is friendly with all of us too.  I really do believe that she treats us workers all the same.  f we have problems, she helps us.  If we need any additional products to do our work, she really tries to get it for us as soon as she can.  She provides meetings a lot to talk to us about  her concerns or if she has complaints about any of us.  She holdsmeetings for all of us and also private meetings for any one of us if she needs to talk to us in private."
32,"1. When I joined the organization, he provided all the required care and assistance. Even now, he asks me for any required guidance and approves any required training for me. 

2. My leader always valued by opinion in all the activities related to the orgnization. Whenever there is any disagreement, he sits with me and try to understand my point of view about the problem.

3. My leader does not show any discrimination between the people working under him. He treats me and others in this team equally. He mintain a good relationship even with people who are not considered to be so good performers in the organization."
33,"My leader, which is also my manager, is very considerate. He always asks if I can do the job correctly. He also offers his skills if there's something I don't understand. My leader respects each and everyone in a way that he is not bossy- type of a leader He really loves working with us and it makes me happy that my leader gives time for us when we need him. I have no issues related to my leader because he's so generous and humble to us. My leader treats us fairly. And that's how I describe the working reationship of my leader. My leader and I are working almost 2 years and we never had some big issues with each other."
34,"There was limited coaching and development, more of a throw you in and you either sick or swim mentality. With very limited training it is hard to really know what is expected of you, what the overall goal of the company is and how to proceed in finding yu fit within the organization. All these item can be tricky when entering a new work environment and social arena. My leaders behavior shows they respect me every once and a while with kind written words. The leader is not one to express emotions or appreiation well, it is a great effort on mynleaders part so I have learned to extend that curtesy to staff. Ocassionally I will,get verbal compliments of appreciation and I receive them more so than other employees and outside staff. My relationship with my lader compared to others in the work place is far better, I have earned the leaders respect and go out of my way to show the leader I put in that extra effort before I am asked. This allows me to have that extra one on one time with the leader as well as drectly point out my completed tasks and extra efforts,  to so they can be recognized and compensated but so these efforts can me remembered later. Overall, my relationship is good with my leader currently. However, I have only been employed there in this apacity a limited amount of time. It is my understanding that overtime the relationship with the leader always comes to an impasse sort of a falling out. It is my great effort to not have that happen and keep the interest so to speak with my leader. It ismy thinking that doing the extras can only improve my relationship with my leader and prolong the good relationship."
35,"My leader provides a good deal of coaching and development but I think this is mostly due to that being part of his job description and it is a state mandated role he undertakes. I do not believe he provides this coaching and development out of any personl connection with myself. He has always been very respectful in our interactions with each other and always shows deference to my expertise in areas that he has a limited knowledge of. I believe my relationship with my leader is the same, no more, no less than that of my fellow co-workers. There are some who connect with him on a different level due to personal hobbies but not much more than that."
