ID,Text_Input
266,"1) My leader provides me with great coaching and development in terms with my work, work attitude, and professionalism. She is a brilliant leader that should be a role model to everyone who works with passion.

2) Yes, my leader behaves that she is showin me respect and a good interpersonal relationship even though she is my boss.

3) My relationship with my leader as compared to my co-workers' relationships with her is the same for all of us. She gives us equal attention and respect but she tends to bondmore with my co-workers whom have the same gender as she was."
267,"My boss cares about me. She understands that I do my job better when I am satisfied. That is why she is interested in providing me with everything I need to perform my duties. I am not quite sure how my boss should show me that she doesn't respect me. I dn't remember such behavior. At the same time, I do believe that my boss respects me and my coworkers. We have really good relationships in our company. Every member of our company can be sure that he/she is valuable for the company and that the boss will elp in case of need."
268,"My leader offers opportunities for me to improve my skills by sending me to conferences and workshops, and inviting me to meetings that might be beneficial in addressing the intricacies of my work. I think that this in itself shows that she has respect fo me, as a colleague and co-leader of our group. I think that our leader shows the same gratitude to all of my co-workers. I've not yet heard a complaint, or felt that one person was singled out over another. She is very good at giving constructive advice n a fairly timely manner and indicating what skills need to be polished or worked on. We work in philanthropy, however, and I also think that this field is very different than most others."
269,"My leader is not particularly helpful when it comes to some situations. When I am having a difficult time with a project and need help, he is often hesitant to provide any. Still, if I need a day off due to a family issue or a doctor's appointment, he almst always approves my time off. My other coworkers seem to have similar problems with my leader in terms of getting constant phone calls to come in to work on our days off. This can be really frustrating when you only have 1 day off every few months. As fr coaching and development, he doesn't really provide any coaching and there is very little room in the company for advancement."
270,"My leader is not very good. He relies heavily on other's experience to mask his own incompetence. I get along with him fine as a person, but don't particularly respect him as a leader. I know that I will usually have to work twice as hard to make sure tha I am not blamed for his misdeeds. He usually interacts the same with both myself and other coworkers. He has only really thanked me personally twice in all of the time that I've been working with him as a leader, and instead expects me to do things aboveand beyond without any additional recognition."
271,"I have a good working relationship with my manager. She definitely respects me and will leave me alone to do my job. She doesn't provide much coaching, but she knows I don't really need it. She shows me that she respects me by leaving me alone and not beig a micromanager. I think my relationship with my leader is much better than her relationship with my coworkers. Before she was my manager, she was in the same role as me at work and we worked together on many projects before she took over as my manager. o her and I have more of a friendly respect relationship as opposed to a working relationship."
272,"My working relationship with my leader is pleasant and friendly. We respect each other. My department is slightly specialized so they coach me to the best of their ability outside of that specialization. My leader shows that he respects me by commending te work I do, and listening to the problems and complaints that I have. They take the things I say into consideration and act on them if appropriate. My other coworkers have a similar relationship with our leader. He is kind and fair, and respectful to allof the other people that I work with. He is sometimes a little too relaxed but that comes at the cost of being so nice to everyone."
273,"My manager does not provide very much leadership or coaching unless asked for. He tends to be fairly hands off and intervenes only when necessary or when I have my review. This makes it difficult to show him that I am doing well with my current tasks becase he is not available to see these advances. If however I have a problem and come to him he will make himself available for these types of questions or concerns and provide me coaching on what to do, or he will do it himself it he feels it is necessary.  enjoy this aspect of our relationship."
274,"We have a decent relationship. It started out rocky but has improved as time has passed. I was rude to her at first, so she was nasty to me. As I began to accept her leadership and treat her better, she has treated me better as well. I've had to learn to ite my tongue and be respectful, even when I disagree with her. Other co-workers have had better relationships with her than I have. She has favorites and work and she does not care to hide this fact. I'm definitely not her favorite but we are a work in pogress"
275,"My relationship with my leader is pretty standard. We have been working together for just over six years now and haven't really had any issues. She provides coaching opportunities when they arise and if she feels I need them. I am quite an autonomous workr and a high performer, so for the most part she pretty much leaves me be to do my thing. She is there for me should I have any problems or need assistance with anything, but other than that, we meet once a month for my monthly reviews. She does ask me todo more sidework than others because she knows I can handle it and will get the job done."
276,"I recently changed jobs and have been at my current position for one month, so I will use my previous manager for this exercise. My previous manager was very focused on my development, and went out of her way to encourage me to take specific training clases. Also, she offered to sponsor me as I worked to obtain an Information Security certification which she already attained. In terms of respect, my previous manager spent a lot of time away from work due to family obligations. Therefore, she was very openand receptive towards me doing the same. I never feared missing work for family or personal engagements. Under my previous manager, I was the only employee who worked for her."
277,Me and my supervisor have a good relationship .He always support me and guide me through his knowledge and I like him very much.He always tells all the perspective and motivate me to do good work.my supervisor have very good relationship with me.he is so ooperative and supporting.he is good by nature and he is supporting to everyone
278,"He may emerge in a group by virtue of his personality characteristics and qualities or by virtue of common consent by group members. In the latter case, the leader derives his power from the group members. He continues in the leadership position at the plasure of group members collectively. Leadership position exists in most group settings irrespective of the size of the group.Leadership is an influential process. The leader is in a position to shape, regulate, control and change the attitudes, behaviour nd performance of his group members. The latter are supposed to comply with the former’s desires and directives and partially suspend their own judgment and discretion. There exists a particular relationship between the leader and his group members whic is characterised by interpersonal and social interaction."
279,I get along well with my manager.  He and I have a professional relationship and respect each other.  My manager allows me a lot of freedom to run my department with little to no interference.  My manager does not check in routinely and has faith in my ablity to manage my workload.  He provides feedback as needed and keeps me informed of performance and other areas.  He thanks me for my work and asks for feedback on his performance.  His leadership style resonates with me and I am able to have similar reltionships with my direct reports.
280,"Working with my leader is easier going than previous leaders. She's patient and shows respect by not talking down to me whenever I have a question. She also shows respect by asking us questions about ourselves because she is interested. She is not just inerested in herself and genuinely wants to know more about others that she works with. Our relationship is the same as other co workers, she is very patient with everyone. That's a good thing because leaders should not have favorites. Her teaching techniqu is thorough and she explains things in a way that everyone can understand."
281,"I have a pretty minimal relationship with my supervisor. He actually works at a different location from me, so we don't see each other super often. Most of our contact is via email, and even that is on an as-needed basis. I really only contact him to ask ermission to take time off and that sort of thing. So, the coaching and development he provides me with is virtually none. He does respect me by giving me time when I need it. I would say my coworkers have a stronger relationship with him just by nature o their jobs, they have to be in contact with him more."
282,"he is very dedicated and friendly , and  feels a good relationship naturally exists, as he provides all times the best coaching and supports us in all terrible situations and helps us to handle in all projects , he empowers others and considers empathy tocreate strong relationship, as he trust me in all situations and gives a clear space when i needed and supports me with all higher official when i have been avoided mistakenly he shows his respect towards me at that time, and behave friendly and as the reationships with other coworkers are somewhat friendly but he helps me and gives more support than other and gives more freedom to work as he believes me"
283,"My leader provides me opportunities for growth and new challenges.  We have regular meetings and have regular talks about the organization and my role in it.  My leader shows respect for me by allowing me to openly ask questions about changes in the firm nd my role in it.  I have also been invited in to discuss what I want to do in the future and what I see my role being.  I think that I have a better relationship with more openness because of this than many coworkers, although there are a few who are jus as direct as I am and share that same relationship."
284,"My leader provides minimal coaching, usually relying on others to ""learn as you go"", which leads to confusion and constantly needing to ask questions when there are new hires. There is little respect shown because the manager hardly interacts with those ""nder"" him. As I am a supervisor, I feel only fellow workers on my level share similar relationships with the manager, and it's not positive. Entry level workers as well as corporate visitors express lots of frustration about how he handles/avoids serious ssues, and supervisors are left to deal with it exclusively."
285,"It really depends on the task I am on. As a team working on projects, I often find myself trap between what I think is right and what my boss think is right. He is the most wonderful human being when we are on the same path and the goal is clear. i have n problem working with him at all. However, when we are on a different track, he often make me want to quit my job because he is impossible to work with. I do believe there is some kind of mutual respect between us, but not much. I have no problem dealing ith my co-workers and we all believe that it mostly our boss falut when thing doesn't go well"
286,"My boss often sends me emails encouraging me or telling me what a good job did on a certain project.  He listens to my concerns and helps me with customers that are difficult or have issues that are beyond me to help.  I am a little bit closer to him thanother workers, but I think that's just because I go the extra mile and often do things to take stress off of him, like make phone calls to customers we all hate instead of making him do it.  He's very supportive and encourages me to ask questions and lear."
287,My leader is very clear and fair when providing criticism or critique.  He is also very clear in his expectations.  The way he treats me is the same as he treats the other employees in our company.  He also tries to put his self in our place to see a sitution from our point of view.  He is good at listening to our concerns and advice.  He also is willing to help if we need assistance.  This leader worked his way up the company so he is good at looking at situations from different perspectives.
288,I have a really good working relationship with my direct manager.  He has an open door policy and is always willing to give guidance and advice.  He allows me to do my work and does not micro manage at all.  The down side is that when you do need help or uidance you definitely have to ask for it.  My relationship with my manager mirrors the relationship I have with my direct reports.  My manager takes a real interest in me and I in turn take a real interest in my direct reports.  He values my input and le's me know that at every opportunity and I do the same with mine.
289,"My work relationship with my leader is amicable. He and I work together regularly, and he respects my thoughts and opinions on work. We share ideas and bounce it back to each others and other co-workers. He is always willing to listen to what his subordintes have to say, which goes a long way towards making the work environment a pleasure to work in. Without his input and trust in the team, i would not think our division would be nearly as effective as it is today. I am sure his leadership style is what mkes us so effective in day-to-day work."
290,"I have an open and frank relationship with my supervisor. We are in constant communication about work tasks, performance, compensation and satisfaction. My supervisor is always asking for my thoughts and opinions on our job tasks and treats me with respec. He values my input and is not afraid to share with others. He will provide appropriate feedback in a respectful manner, and recognize my efforts to his superiors. He cares for my well being and makes sure that I have a good work-life balance. My relatioship with my supervisor is similar to relationships with other coworkers, one of respect and cooperation."
291,"I would say that our relationship is conflicted. He is a very large hypocrite and not very friendly towards my coworkers, but he seems to like me very much. As a result, I don't often stand up for my coworkers or share in their emotions about him. I have lways said that my priority in work is to get ahead first, not make friends. I won't necessarily step on anyone in the process, but I will always do what I need to do to be successful. That being said, I believe he does have his heart in the right place, ut not always at the right moment."
292," I have a good relation with my leader, he cares me and I get good feedback from him.we all are a team and there is no superiority complex among us.I like to work here because this is an amazing placer.We feel like we are a team and so we have common respnsibilities. We won't criticize each other. But will advice if one of us makes a mistake.We will teach patiently about it and so the other one is not desperate. I think that is a good way to be followed in an organization.I ilke to work with my leader."
293,My leader is a micro manager. He wants to be involved in most tasks that are performed in his group. While he does value contributions with verbal thanks on some occasions it usually is not reflected in yearly reviews. At first I thought it was my performnce that he did not like but I asked others in the group and I was told that he is the same way with all of my peers. It is very frustrating to work so hard and not be rewarded for your work. I think it is time to look for another position.
294,I don't recieve any coaching or guidance from my manager but I certainly would like to. My manager respects me somewhat. I guess she could be worse. I don't appreciate last minute schedule changes. That's very disrespectful to me. Some of my co workers ar closer in a business sense to my manager than me. They've been working there longer. And they are just more extroverted as well. But I don't know how well their relationship is with our boss so you would have to ask them individually because it's none ofmy business and I stick to myself at
295,My leader provides me a proper and clear vision about the organizations goals and its expectations from me. Also he guides me the steps required on day to day or weekly basis so that each day I am moving towards my goals and proving my worth to the organiation. If any mistake committed on my part then instead of torturing I get a clear coaching of what my mistake is and in future how I can avoid it.
296,I would say that I have a somewhat unusual relationship with my manager in the fact that I trained him for his job. His predecessor (my last manager) had left and I was filling in until they could replace her. During that time I learned her job as well asfinished learning the ropes of my own job given the fact that I was only with the company for five months when the last manager left. Therefore I actually ended up training Bryan when he came in. He depends upon and trusts me a great deal in our relationsip and our working together is really more about a collaboration than would be typical.
297,"My manager doesn't provide me with a large amount of coaching and development. However, that is fine with me because I don't want somebody annoying me anyway. I dont think I need somebody hovering over me to provide guidance, even when it's not jrcrssary.y leader shows that he respects me by being considerate and respectful when dealing with me. Our communications and interactions have always been civil and respectful. I would say that my co-workers and I have the same type of relationship with our supervsor. He doesn't appear to choose favorites, and we all seem to be on the same level."
298,"Although my manager accept me as a good worker, he still can't be a dependable leader.  He sometimes, desert the workers in between in times of adversities.  He can't be counted on times of emergency.  Sometimes he is not accessible too.  When we have som important family matters to deal with and leave is a necessity, he just ignore all the good works that we did in the past and just harass us for asking for a leave.  That behavior always irritated me a lot.  I just couldn't get along with it.  Secondly h is just focusing on goals only, but never bothered about the  ways by which we can attain the goal."
299,"My relationship with my leader at work is particularly professional but we enjoy our impersonal relation also in some other setting. My leader is ideal for me because he has trained me from the basic. He always have a sense of humor at highest. Not, only e he favors all the staffs also motivates for work quality. He is ideal for every employee, he gives emphasis on enhancement of personal skill. One in another way, he's been perfect leader, motivator, persuader, he is the central figure on which everythin revolves around. Frankly, speaking I am close to our leader in many impersonal settings precisely outside the office premises."
300,My leader is very good at his job and encourages all of us to do the best we can. Our leader respects everyone at our work and is very vocal about coaching us to be the best workers we can be. My relationship with the boss is the same as all the other worers. Our leader cares for us all equally and is willing to do whatever it takes to help us succeed. He is willing to help any of us out with anything we need withing reason. Its great to have such a strong willed person leading us and letting us know we cn accomplish anything.
301,"My leader is a former mid-level military officer.  He has not made a noticeable transition from his military days to his new role in managing civilians.  He rules with a slightly weakened iron fist.  He expects full attention and allegiance, doesn't accep the opinions or suggestions of subordinates, is not friendly, can be rude and unforgiving, but runs a productive division within the company. He treats all of his subordinates equally and I suspect that most of my co-workers would share my opinions fairl closely.  There is little if any positive feedback.  The reward in doing the job is to be found in knowing that one's responsibilities to the company and to the customers are being fulfilled at a high level."
302,My relationship with my manager is very open. She is future oriented and anticipates changes. She is also open to my feedback as she knows that I can tell what works and what doesn't because I work with the company software on a daily basis. This working elationship has headed off potential project failures because I am able to see the limits of the software in relationship to what my manager is trying to do so that she can implement upgrades and procedure changes. My manager recognizes each of our strenghs and weaknesses and works with us on an individual basis. She does not try to get us to compete against each other.
303,"My relationship with my ""leader"" -- the HR representative who is over secretaries -- is rather good.  I'm viewed in sort of two ways by HR:  (1) a very valuable asset who is extremely capable and agreeable - in short, someone who is willing to help whenevr needed and who can do almost any task given, whether secretarial, IT, or web design; and (2) someone who they don't really like because I'm very smart and they have the notion that I am a bit superior, which I really try to not convey.  They are always ery, very polite and sometimes friendly.  One slight way in which they could show respect more is that when asking a large favor -- to cover someone extra for, say, 3 months, they could be courteous enough to walk down the hall (100 feet) and give the assgnment in person.  Obviously, phone is fine for small requests.  

My relationship as opposed to co-workers?  I can't say.  I think they are generally fair and polite to everyone.  Perhaps they have personality favorites -- I do not know.

We get training but only as needed to do our work."
304,"I really receive no coaching at all. My supervisor takes a very hands off approach. I think that I only get talked to if I do poorly or if I screw up. I think he may or may not respect me. He really only speaks to me when something goes wrong or when ther is new information that he has to give me. I do quite well at my company and I am glad that I do because other people constantly have to talk to him and get talked down to by him. People who do not perform as well as I do are constantly being forced to iteract with him. I am excused from many meetings and conference calls that others are forced to attend/be on. From what I hear, these meetings and calls are less about managing or coaching and more about complaining and demanding better results"
305,I have e been in my position for 9 years so I do not need coaching or development. My leader stays in his office. Some of the new people don't even know who he is. Ver anti social. It's always their way or the highway without a solid explanation. Relationhips with co workers far outweigh in a positive way than relationships with managers.
306,"The relationship is cordial and professional, but definitely one-sided. My manager cares about my job satisfaction only to the extent that it affects results and thereby, his performance. He does offer advice, but generally that advice has less to do withme and more about how to get around obstacles, and often the recommended approach is acquiescence by me. I wouldn't call that coaching. In terms of respect, he does make himself available and is quite a good listener. Generally, I would say that I am treaed on par with my peers, that is to say, my manager's behaviors are no better or worse toward me than toward others."
307,My leader provides appropriate and necessary training.
308,"Our leader provides very good coaching and gives practical training , He treats politely and greets well. He responds immediately to all my issues and considers my requests a lot. He is always humble and loyal to me. This was a pretty stupid thing for me o say, but I still think my point was right. In some organizations, almost anyone can get promoted to management if they put in the time and play the right politics. Instead of trying to become a mere manager, therefore, why not aspire to become a great lader?"
309,My leader is often in the background at my job but always make an effort to interact with me each week and praise me for doing things.  He always is available by email or phone and always makes an effort to ask how I am doing and how we can improve the enironment that we work in.  It is a really positive relationship because he will bounce ideas off of me and I can do the same with him.  We have  a great working relationship where he really lets me do what I want as long as I get the job done correctly an efficiently.
