ID,Text_Input
102,"My manager is very standoffish.   She doesn't take the time out to get to know the workers personally.  She is only interested in results.  You will only hear from her when something goes wrong.  When you are doing a great job you won't hear any praise bu if you do something wrong she then wants to talk to you.  I don't feel like my efforts are appreciated at all.  I feel that if a worker is helping the company to make money, that employee should be appreciated and made to feel like they matter.  If a worer takes the time out to do all that they can to work, the supervisor should take notice of this.  I don't think that the supervisor that I have really even makes note of good things, only things that don't matter.  For example, if I do well in the sales epartment she won't say a word that week.  Two weeks later if I fall behind in sales, she will then send an email to me saying ""she needs  to see me.""  If I did well all the time I would literally never hear from her.  It is very sad that it is this way bt it really is this way. 

My supervisor does not take the time out to find out what my needs are.  She is only interested in exploiting any problems that I may have in order to make herself to appear smarter or better than the rest of us.  I have never flt close to her or that she would ever try to help me out of any type of bind.  I would never even ask her for a favor because I know that she wouldn't go out of her way to do anything for anyone other than herself.  She is not a people person so I don't now why she is a manager in the first place.  This doesn't seem right to me at all."
103,"My leader is a very competent intelligent, hardworking person.  He is very knowledgeable about the job he has to perform and does it very efficiently. He had a great personality and is well-liked by employees. He provides  everyone and that includes me wih the skills needed to complete a job. If their is need for coaching instructions, he makes sure his employees get it. He is caring and concern about all his workers, he treats them in an equal fair manner.  My co-workers admire him so much, they try to d a very good job pleasing him.  My leader informs us of   policies and  informs us on the effects that will have on us.  He makes sure our working area is safe and secure."
104,"My leader is stern yet fair. He provides the know how in order to succeed but it may not be clear all of the time. In the beginning I received much support and training but now it's more of a hands off support. Even though, when I see him, he gives me a sile and asks me how I'm doing and performing. He relies on the fact that the training he gave me provides the foundation of my work. Along with reliability, he sees in me dedication to the job beyond the money involved. Being management just under him, I'e spent the most time with him and am thus the closest. To summarize, I've been granted the opportunity and responsibility to manage the problems within my ability."
105,"My boss at work is really a remarkable guy. He didn't start out as a manager, but worked his way up to being one so he knows all the in's and out's of every job. He's been with the company for many years and knows what it's like having problems. He listen to everyone (he literally never shuts his office door so you can just walk in and talk) and does his best to make ""work"" not seem like ""work"". If he can't figure something out or doesn't have a good answer, he takes time off of work to call someone abovehimself and resolve things himself, for you. The other co-workers all seem to like the boss as well, as he doesn't just save this attitude for myself or another, but shares it with everyone equally."
106,"I have very little interaction with my leader. Thankfully my position does not require very much supervision or direction. However, we interaction is needed it can be very difficult to get the needed time from him, he often will miss scheduled times to tak as well. I think that most people I work with have a very similar relationship with him as I do. He does try to be motivational and provide valuable information, but when you need something from him it can prove difficult to get the time you need. He shws more in word than in deed that he respects me. Overall we have a good relationship, but I get most of what I can done without him."
107,I have a great relationshup with my leader. He always coaches me and the entire staff so that we could be better educators. He respects us because he always ciritiques us in private but loves to publicly give us praises. I have a closer relationshup to hi than most of my colleagues because I am the chairperson for our insrtructional team.
108,"My boss is great at playing to the strengths of each of our employees. When someone is hired on, after they are trained, my boss takes the time to chat with them, figure out what they are best at and what they enjoy doing the most, and then works with the to set them up to do more of those types of things. I believe she treats all of our employees equally, and there has been no display of favoritism."
109,"My leader provides us with weekly training for the entire organization. There are many of us who are able to have coaching calls and other communications with my manager. My leader does not do a great job in showing respect to me. My relationship with my eader is not as good as my coworkers. I do not feel entirely appreciated, and in fact it seems to be there is some issue between us, though I do not know what it is."
110,"My leader gives me the opportunities I need to work independently and grow and learn how to better and more efficiently how to do my job. However, he is always available for me to ask questions to improve myself if I don't know how to do something the bes way possible, because he recognizes that the outcome is more important than the method."
111,My manager doesn't provide much coaching. He expects me to figure out how to do things. He is always willing to give me a direction when I have a question. My manager has a more professional relationship with me. He has a more friendly and personal relatinship with other people in the department because eh ahs worked with them longer.
112,"my leader is very good, he directs me to do the right thing and he is fair in the tasks he gives me to do. i enjoy working for him and I am happy to come to work every day. he treats me with respect and treats my coworkers the same also. i feel as if my lader is very good at doing his job and I do not regret working under him"
113,My boss provides coaching in the way of encouragement in wanting me to do better and continue improving in my abilities by assigning me more work tasks and more challenging projects. He shows respect for me by not making me drive a bigger truck than what  am comfortable with. I drive a small truck for work to transport hazardous waste and I am not comfortable driving a bigger one and he does not make me since I help out in many other ways that the other drivers do not help out with. Other relationships hehas- two guys- they swear at each other and often argue but then in his own ways of apologizing or giving back to them he gives one more freedom in lack of work duties and the other takes out to lunch.
114,"My working relationship with my leader is exemplary.  Since we have been working together now for almost two decades there is very little coaching and development at this point but they always provided it earlier in our careers.  My leader respects my exprtise greatly, always deferring to me to advise or even make decisions when it involves my personal work experience.  My relationship with my leader is slightly better than the leader has with other coworkers due to our longevity of working together, but therwise my leader treats everyone the same."
115,People who have been there longer probably get more attention or reciprocation than I do. My manager expects me to learn more on my own and does not neccesarily return favors. I don't know how he would. I am shown respect mainly by being able to choose myown hours. When I have something personal to do I can take the day off without problems. I am given freedom with my hours and sometimes I can choose which tasks to complete before others depending on what it is.
116,"I think that he respects me because he asks me what happened before he assumed I did something wrong. He likes to get a perspective first. However, he doesn't do much in the way of coaching. I think that's because he doesn't really know what's going on. Ithink my coworkers have a greater understanding, so they're better resources."
117,"The chairmen is our department leader who I report directly to. He sets and holds a hide standard. With this he gives a lot of freedom for us to complete our work at our own pace and skill. If you are not producing, we will put the hammer down but other tan that he is very supportive and if I need any assistance he will get it done."
118,"My leader does an excellent job cultivating an independence in my practice. To do this, she takes time to correct my deficiencies and provides real-time feedback on how to improve for the next assignment. She takes time out of her schedule to go over assinments in details. She provides this same level of insight with other co-workers while they are on service with her."
119,"My leader shows that she trusts me. Over the course of the last year she has a propensity to defer decisions to me that show me this trust. I can tell this is a different relationship than what she has with others, but it is beneficial to the both of us. y giving me the ability to decide things, she shows she cares. My leader shows incessantly how much she believes in me by telling me how a good job is done and how she has elevated expectations for me."
120,"My leader doesn't much care for his people. Even when i excel, my leader doesn't appreciate or acknowledge at all how well i'm doing. Couple that with the fact that i don't get pay raises, it's very humiliating and demoralizing at times. It makes it very ard to go to work and do my job. I don't much care to excel anymore because i know he won't care and i will only do the minimum."
121,"My leader provides virtually no coaching/development, and generally makes capricious demands. That said, he does this to our entire team, so I don't take it personally- he's just a bad manager. We have corporate-dictated progress meetings/development goal, but he ignores them and evades our efforts to get him to abide by policy."
122,I am very lucky because I have a great boss/leader.  He values my work and encourages me.  I enjoy working for a leader that is easy to talk to.  He is very easy to go to with issues and always helps me find resolutions.  He is a good manager to everyone. He is always friendly and easy to approach.  He makes the workday easier and less stressful with his playful and encouraging attitude.  He also does a good job of acknowledging my successes.
123,"My leader has faculty meetings for us every month and that's somewhat coaching.   My leader does not need to show us respect.  My leader has announcements for us everyday that points us in the right direction of what needs to be done.  Also our leader emals us with updates for the week ahead, gives us a schedule of whats going on in sports and other extracurricular activities.  He shows me by being a leader and giving a great vision for the school at which I work.  The relationship with other workers is te same as the one with me."
124,I good relationship with my leader.  He really lets me work with little supervision.  I think he could be more attentive to my needs to make more money.  He does compare very well to other leaders I have worked with.  He does have the skills to lead.  I jst think there is a time when someone needs to also nuture and a lead   it comes down to just helping out
125,"1) My manager, or as we refer to it ""team leader"" doesn't offer coaching to me, as I've been doing my job much longer than he has, and he is comfortable with my judgement. 
2) My team leader calls, texts, and emails me to thank me for accomplishing specifc tasks, or to compliment the manner in which I completed them.
3) My co-workers have a similar relationship with the team leader, though as I am his direct subordinate I have more regular interaction with him."
126,My manager does not need to provide coaching and development. When I was hired it was assumed that I was pre trained and ready to work. My job also entails a skill set that my manager does not have. I know that my manager respects me because he gives me te freedom to do whatever I feel fit to complete my job. My relationship with my manager is cordial but much more formal than it is with my co-workers.
127,"My leader provides me with some amount of coaching, however, the vast majority of my development comes from research I have done outside of work and that can be frustrating as he will just tell me to figure something out and it will be much harder a task han he thinks it is. To be fair though, my leader often shows praise and respect for me, and I would say the respect shown is comparable to my co-workers."
128,"I would describe my working relationship with my manager as extremely positive. The coaching he provides does help me actualize my goals, and the respect shown is great for the workplace. We all work together as one team, one entity, so it's great to havesuch positive relationships with the office. Overall, the experience with both my co-workers and manager and the workplace in general is extremely positive."
129,"I have a you leave me alone, I'll leave you alone relationship with my supes. They have no real power to do anything about anything here anyways. Everything is so tied up in the union and bureaucratic bs that its a pointless position. They can threaten mebut the union will protect me from their idiocy. They cant do anything and they know it. So they stay out of my business and let me do my job how I see fit, and I try not to make excessive work for them. Its an understanding that works for us."
130,"There is no coaching. We talk about what needs to be done that day at the job. We discuss how we will go about doing it and what it the best way. When then both get down to work and if questions arise or concerns throughout the job, we will pause and talkto each other."
131,"My leader provides me as much coaching as I require in order to do my job well. He also occasionally calls me, especially on nights that he knows that I am working late, to make sure I am okay and still motivated.  I think I have a better relationship wit my leader than many of my coworkers because I work harder than my coworkers and my leader respects that."
132,"Provides enough coaching when the situation calls for it. Provides enough development when the situation calls for it. Provides appropriate respect, although there could be more respect shown to boost our confidence higher. Relationship are unequal betwee coworkers and leader as most tend to take leader's considerations first. Seems to not show favoritism although I am not sure."
133,My manager and I work well together but she does like to micro-manage a little too much. Overall she likes telling others exactly how to do things but tries to give incentives. When I have a problem she will help me find a solution. I think my manager truts me more than my coworkers as I am older and have been with the company the longest of anyone there.
134,"1) My project manager allows me to develop my skills and do stuff I'm not familiar with. Not really coaching since he's no expert at what I'm doing at work.

2) Has never yelled at me. I can usually negotiate with him (e.g. have to leave earlier, want to ork remotely, need to have a day off). Gives me positive feedback.

3) I think our relationship is very professional and on the same page as with others."
135,my boss is usually very forthcoming with any new information about the company and the direction in which we are going.If i am doing well my boss will really praise me and anyone on my team for doing well on any job that we are given.he treats every one wth dignity and respect just the same as he does with me.my supervisor really knows how to handle and lead a team and does it without being hated or resented unlike some bosses that i have had in some of my past jobs and positions.
136,"My supervisor is removed from the day-to-day operations of my department, so much that all training is done by other employees. It is difficult to implement effective changes to processes and work flow because of my supervisor's detachment. My supervisor oes not show respect for any employees in that she ignores direct communication, demands overtime, and does not perform employee reviews as required by the company."
137,My boos and I exchange ideas on a daily basis. He often asks for my opinion in matters that occur through out the day. We bounce ideas off of one another and see how they fit into the grander scheme of things. My boss thanks me every day for my contributins to my job.
138,My leader motivates me well in work and guide me well in profession ........... ................ ........ ............ ........... ............... .... ..... .... ..... .... ... ... ... .. ... ...... ...... ..... ..... .... .... .... .... .... .... ..... ... ... .... ..... .... ... ...... ..... ..... ..........
139,"There is very little relationship between myself and my ""leader"".  I'm new to the area I work in and I feel mostly ignored by him.  He will always stop to talk to my coworkers, but I may as well not even be there.  My coworkers are the ones who train me.  have been in this new department for about six weeks now and I am learning my new responsibilities, but little of this training has been from my supervisor.  He seems content to sit back and watch my progress."
140,my relation with my coworker is very good. It is just like my best friend and my well wisher. No one in my life I have git before caring for me soo much. He always provides me coaching and make me learn everything very nicely. My relation is better than ohers workers .
141,"My leader only gives me the mandatory new info from our corporate branches when they mandate it. Otherwise she just does her own thing and doesnt coach or develop anyone. My leader's only concern is about making money and profiting the company, she does nt discuss anything else.I think all of the people at my company have the same relationship with my leader and that is a direct one concerning work and nothing else."
142,"My leader does not provide much coaching but will provide tips or advice whenever I need it. My leader shows me respect by listening to my concerns and treating me with integrity. My relationship with my leader is the same as my co workers. We are all treted fairly without any biases. He does not favor anybody, if your work is good, you will get benefits."
143,"My leader doesn't really coach me or help me develop.  We both have pretty similar job requirements.  The only reason he is my boss is because he has longevity at the company and was given a higher position.  We both do the same things and it's not reallyrelevant for him to coach me.  He does respect me, and I respect him.  We don't respect each other in a leader/subordinate kind of way.  It's more of we respect each other in a professional colleague sort of way."
144,"My manager always show me respect in the office. Also provides incentives for doing more than is described in my work contract. When I need so advice he generally has some to give. Sometimes it is even good advice. There is always a friendly word availabl. I seem to be one of his favorite employees, for example when I want a few hours to myself I get it, most other employees are simply told to get back to work."
145,"I think my relationship with my leader is comparable with that of my co-workers. While there is some feedback, mainly we are expected to work on our own and manage our individual workloads and responsibilities. Obviously, if we make a mistake we hear abou it or if a client is very happy, our leader lets us know."
146,My working relationship with my leader is a very friendly yet professional one. He always takes the time to show me the reasoning behind the decisions as well as explaining to me how to fix problems. My relationship with him is the same as well as my co-wrkers. He treats us all the same and that is with respect and kindness.
147,"He is always available to help me with things I don't know or don't understand. He's usually very nice and understanding when helping me with these things and shows respect like that. Sometimes, he gets frustrated if I do something wrong or if I don't remmber how to do something and then he's short with me but still helps. My coworkers that are good at their jobs or very friendly have better relationships with him than I do -- my coworkers that are worse at their jobs have worse relationships than I do."
148,"My leader doesn't regularly provide feedback or coaching.  She does value my contributions and has given me consistently positive performance reviews.  However, she micromanages my work and wants to be involved in every little decision I make.  She does te same with my teammates and ends up being a huge roadblock to us completing our work."
149,My leaders provides a lot of support and is always helping me on issues I have. My leader always shows that he knows what is going on and makes sure he takes his time with me. Our relationship is much more formal than with my other coworkers in the office I like it here.
150," My relationship with my leader is very one sided. He tells me a lot of the problems with the company and his personal life, but I don't share any of my problems. He does try to teach me different things about the construction industry by showing me exacty what he is trying to do for each project. He also tells me that I have contributed to the company's success and appreciates my efforts. I do believe that my relationship with my leader is very similar to the relationship he has with all other employees,as he is very open about his problems."
151,"My supervisor gives me the coaching I need and then allows me to independently do my work. If I have questions or concerns, I can freely and easily go to her knowing she will attempt to help me or give me answers. I feel respected in that she allows me todo my work without micro-managing me or invading my privacy. My supervisor is equally kind and respectful to all of our coworkers and her other subordinates, but I believe she has a strong sense or reliability in me. She knows I will get my work done."
152,"My leader is very compassionate and caring and will help in any way possible. If I do a favor for her eventually she will do one in return. She values me and my co workers and is always saying nice things. She very rarely yells or has to reprimand us we rspect her as she respects us, she can always be counted on and my co workers feel the same"
153,I've been working with my supervisor for about eight years now.  There wasn't too much coaching since we've been working in the same field for about 15 years. My supervisor lets me do my own thing and set very loose requirements for what I needed cheapo wrk. My relationship to my coworkers compared to my supervisor is more of a friendly role.
154,"My manager is new in the field and does extremely well.  She is very forgiving, has no issues when my co-workers or I need her help with decisions or managing customer relations.  She always has our back.  As well, if my manager needs help, she does not hsitate to get opinions or advice from her employees.  She is possibly the best manager I have ever dealt with, especially considering her young age and length of time in the business."
155,She is very supportive and keeps me going when times are busy.  As far as coworkers go she treats everyone the same and is pretty upbeat most of the times.  She has no problem jumping in and helping when 
156,My leader does not provide me with a lot of coaching themselves. They do give me access to materials for professional development though.  My leader shows respect by understanding that I require a good work life balance.  My relationship with my leader isthe same as with other employees.
157,"When I joined the company, I had little to no experience in my role. Day 2 at my job, my lead took me into a major meeting and told me to run the meeting while he messaged me a few tips and pointers. I feel like they definitely respect me and our entire tam has a relevant relationship with him."
158,My leader always try to keep me up to date on my job's area. She always want me to keep learning to improve my skills. She respects me very much and she tells me the truth no matter how hard it is. She's the same with me and all my coworkers. She treat usfairly and doesn't have favorites.
159,my manager trust and believes in me he is willing to listen to me and my ideals.if he really needs to get things done i am his go to guy i do on occasion stay late if im needed to get things done  and on some occasions he will let me leave early if i needto without holding me accountable
160,"My manager provides me with a minimal amount of coaching, leaving me to figure out what must be done at work. My leader shows average respect by sometimes being a help, and other times, by being a hassle. My relationship to my boss differs from my co-workrs, simply because they have had years of employment with the employer, so this has given them more time to form a personal relationship with the manager."
