ID,Text_Input
354,"I have a great relationship with my boss. She's possibly the best supervisor I've ever had - very collegial, very respectful, and appreciative of our value and skills. She is not big on demonstrations of authority or hierarchy, instead she really works asa team member with her team. She does provide direction and a sense of mission, but she really works with us, and never acts in an authoritarian way. About being respectful: she always listens to what we have to say, clearly values our input and lets us tke ownership of our projects. And she never acts like she matters more than us in the great scheme of things. As far as I can see, she acts the same way with all her subordinates - I don't feel like I have a ""special"" relationship with her, she simply is hat way with everybody. When it comes to coaching and development though, there is not much of that going on, probably because of time constraints."
355,"My manager more or less treats me like an equal. She has been a great mentor and helped me to grow my skills a great deal since I have worked for the company. I sometimes think she struggles with delegating and with finishing tasks because she takes on th bulk of the workload, so I try to help her out whenever I can, and I know she appreciates it. When I am feeling overwhelmed, she steps up and takes something off my plate for me. We are also friends outside of work. Overall, I think she is a great leader"
356,"We have weekly staff meetings that are lead by my manager. She uses that time to give the over-all big picture, but also will speak with us individually about tasks and goals. She's also willing to give one-on-one time to focus on my future goals within te organization. I believe the best way my manager shows her respect is to be hands-off. She's not constantly hovering over us to check our work or see what we are doing. I connect more with my manager on a professional level whereas I have coworkers who cnnect with her additionally on a personal level."
357,"I mostly have negative opinion with my partner. I sometimes get upset with him. in case of any problems , I have tom face him terribly. I have worst experience compared to my other workers relationship. So my relationship is not that much secure. Passive ggressiveness is a strategy used when a person basically isn’t able to confront issues directly so instead will use indirect means of criticizing you. It could be in the form of comments or actions that make you question yourself or cause you to make mitakes."
358,"My relationship with my leader is a give and take and is better than most of my fellow co workers. My leader gives me more space and relies on my skills and commitment to take care of my responsibilities without having to be a helicopter leader. My leaderhas not shown me much coaching beyond my initial training period. However, there are some times when the leader goes out of the way to demonstrate a new selling or promoting technique to me as well as other employees. But for the most part my leader has ahands off approach as looking no as the leader is kept in the loop financially."
359,My leader is typically there for me and willing to help develop me professionally by providing on site training and development activities throughout the year. She shows that she respects me by understanding if projects do not go correctly as planned and s willing to work with me to figure out better solutions to problems. She allows me to do things my way and lets me work independently without always feeling the need to be over my shoulder. My relationship with my leader is about the same as my coworkersrelationship with the leader. There is not much variation in one individual having a much better relationship than another.
360,"I'm the equivalent of Milton in the movie Office Space. I had my own office at one point, now I'm in a cubicle on the other side of the building next to the filing cabinets in a corner all by myself. Everyone forgets that I even work here because I'm thatfar away from the rest of my coworkers. I'm not included in the department updates, nor the memos, they have meetings without me, etc. My boss gets along with everyone but he is not as friendly with me."
361,"We have a good relationship - my manager is less technical than I am in the field we work in, so a lot of our working relationship is less technically-minded, which is a bit frustrating for me - so the coaching aspect of our relationship is less about theactual work I'm doing and more about managing the soft skills of the position. My manager definitely respects me and frequently tells me and others that my contributions are great for the company. Among other coworkers, everybody respects and enjoys beingunder the leadership of our manager - they do good work."
362,"My leader routinely coaches me on the softer skills that are required for advancement. He has much faith in my technical skills and abilities to do the job, but he works frequently with me on building out the larger skills required to have long-term succes in business. 

He treats me with a friendly demeanor, although not afraid to correct incorrect work or actions firmly. It is honestly a wonderful relationship and I feel he treats my colleagues similarly. 

As a whole, I can say that he has my interestsat heart, while also working to advance the organization and I cannot ask much more than that."
363,"When I joined the company I was new to the corporate culture. I was even naive about my dressing sense. My supervisor too time to explain me on how to present myself. I was so straight forward and too honest to be compatible with colleagues. He asked me t stop teaching others about morality. He wanted me succeed in life and in my job rather than fighting and teaching others. He asked me to be a role model to others.

After few years, whenever there arises a crisis, he tell everyone to learn from me. 

Thogh he does the same for others too, only few people learnt from him. I am proud to say I am one among them."
364,"My leader and I have a good working relationship. We have semi-formal join-ups every quarter (three months) to discuss more work plan as well as my career goals. He also provides me with an assessment of my potential within the company. Outside of these jin-ups, we have informal conversations nearly almost every day. We both work near each other so we see each other every day. I enjoy working with someone in person vice remotely. My leader provides very similar feedback and behavior to my other co-workers Overall he is a good leader that understands his people and enjoys working with others."
365,"My leader does not provide much coaching or development.  We have mostly the same work tasks and demands.  He just so happens to have been with the organization longer than I have, so he has seniority over me.  We do mostly the same.  There is no need forhim to coach me much, and I'm expected to coach myself, and learn any aspects of the work myself.  He certainly respects me, but he doesn't really show it.  We have a pretty mutual empathetic relationship for each other.  We work alongside of each other t complete the same objectives, and we cooperate and try to stay out of each other's way."
366,"My working relationship with my supervisor is nearly perfect. If I make any mistakes, which I rarely do, I can expect fair and concise coaching on the subject. My leader shows that he respects me on a daily basis by asking for my ideas and input on work rlated manners. I believe that my coworkers also have a very appropriate, warm and friendly relationship with my supervisor. I believe that he is fair and understanding and everyone that appreciates that does benefit from his experience and interactions. I people have a good work ethic they have no trouble getting along with him."
367,"Last year my leader at work was also the one who formally evaluated me so I got to know her pretty well. For the evaluation we had to spend hours together talking about my performance on a really long rubric they must use. I have received a lot of positiv feedback, but also had areas identified that I needed help and future training on. My leader shows that she respects me by listening to what I have to say and praising the good things I'm already doing. I believe my coworkers have had the same experience with this person because she is equitable to all workers."
368,very very good leader to me its may gods gift.he give more respect to me always.all respects same to all peopls.here equality is must.very very good leader to me its may gods gift.he give more respect to me always.all respects same to all peopls.here equaity is mustvery very good leader to me its may gods gift.he give more respect to me always.all respects same to all peopls.here equality is mustvery very good leader to me its may gods gift.he give more respect to me always.all respects same to all peoplshere equality is mustvery very good leader to me its may gods gift.he give more respect to me always.all respects same to all peopls.here equality is mustvery very good leader to me its may gods gift.he give more respect to me always.all respects same to ll peopls.here equality is mustvery very good leader to me its may gods gift.he give more respect to me always.all respects same to all peopls.here equality is mustvery very good leader to me its may gods gift.he give more respect to me always.all respect same to all peopls.here equality is must
369,"I would say that my personal working relationship with my supervisor is better than that with a lot of my other coworkers. He knows that of all the other people here he can count on me to not screw him over in terms of simple things like meeting deadlinesor not being late without good cause. We have a good relationship that also includes a fair amount of humor. I would say that we genuinely like each other, which makes it more fun and easy to work here even or especially during the busiest seasonal times.I think that I would spend effort to maintain this status."
370,I have a good relationship with my supervisor.  She does not really need to coach or develop my technical skills but she does coach me on how to handle policies and regulations set by the company.  I really believe that she values my work and respects my ffort and knowledge of the industry.  She seems to have a good relationship with other employees but she does seem to rely on me more than she does on others.  She appreciates the fact that I need little guidance and I am always helping others.  When she s not there she usually puts me in charge.
371,"Almost for any work my leader believe me to a extent that he simply asks me to carry out the job. Whenever he has doubt in his work without any hesitation or ego he asks me to clarify it. We have a mutual understanding that we both work for the best and w respect each other. The co-workers also have a cordial relationship with me and with the leader. We work as a team to achieve the good ideals of the department. Moreover everyone in the team is more caring, flexible and friendly to work with. Great team ork together!!"
372,"I have a difficult working relationship with my leader. It is very inconsistent and I never know how she will react to a particular situation on any given day. Somedays it may be a positive reaction but sometimes there is a negative reaction to the same stuation. I receive an equal amount of coaching and development as most other staff although there are a few who are shown more respect in situations. I have learned that if I approach at the right time and in the right way, I will have better, more positie reactions. It's also better to ask for development as it's more likely to happen if it's asked for than if you wait for it to be offered."
373,"My working relationship with my supervisor is mediocre at best. He is not what I would call a ""leader"". He is very relaxed and laid back, which is fine, but not all the time. He is quite a bit younger than me and he just does not see the big picture. He des not reprimand and document other employees who should have been terminated years ago. I have a much better relationship with my colleagues and subordinates. I believe my supervisor needs more training and should take appropriate classes on how to be aneffective and efficient leader for our team."
374,"My working relationship with my leader is highly respectful.  He is very intelligent, communicates well, and considers my input.  He is respectful to everyone and encourages good collaboration among all workers.  He is good about spelling out specific expctations, providing needed information to complete tasks and projects and providing enough space and independence and trust of others to get the job done.  He is professional and expects professionalism of everyone.  He is a great role model, he illustrats an excellent eye for details, reliability and accountability, and is very well-organized.  He has been in his profession for more than 30 years and has a strong history with the organization.  He is an excellent resource."
375,"My leader works very closely with me. Because I am on the tail end of being new, he provides a lot of guidance and feedback on the work that I do. He is always respectful of how he presents that feedback and always takes into account how much effort I putinto the product that he is reviewing. He is efficient at what he does, does not drag his feet on any request, and is always willing to take some time to help out. He does this for all coworkers who ask for it--because some coworkers have been here for qute a bit of time, they don't need as much guidance as I do, but will seek it out from him. He is always happy to help."
376,"What I like about my manager, Paula, is that whenever she tells us that she needs some of us to volunteer for an assignment, she also is the first one to volunteer.  I really respect her for that.  A lot of managers feel that they are above it all and onl want the workers to do the extra work.  Not Paula, she is always at the head of the line and I find that inspiring.  She is the kind of supervisor that I would want to be.  I consider myself lucky to have her as my boss."
377,"My relationship with my boss is pretty good in comparison with my coworkers. We seem to have a pretty friendly relationship. However, in general with all of us, he does not provide us with enough direction and expects us to know where to head next. There re some occasions where he makes suggestions, but a lot of the time he just waits for you to present what you have done and offers his critiques and comments for things to improve. Basically he wants us to develop to a point where we know what he wants wihout being told in advance."
378,"My manager does not provide a whole lot of coaching or development opportunities, but rather relies on us to further ourselves professionally. This is the same for all employees except for maybe a few who are new to the company. I generally feel respectedas there is general interest in my personal life, politeness in our work environment, and there is a lot of trust placed on me such as being left alone in the store with valuable merchandise for days at a time. Not all employees have a chummy relationshipwith the boss, and some even go out of their way to avoid interacting with management."
379,"My leader has trained me from my initial hiring, and provides updates on my progress and performance regularly. He meets with me at least twice a month and visits with me daily. He also responds to my emails and questions in a timely manner, and helps me ith any problems I have. He gets people to help when my computer isn't working and I can't do aspects of my job, and isn't frustrated with me when this happens but understands it's out of my control. Other coworkers have similar relationships with him. Ou whole team likes our manager because he is a good leader."
380,My leader is awesome.  He always listens to my issues and advises me.  I respect him because he has worked here longer than I have and has been involved in so many different areas of the company.  He seems to think things through with a clear head and notget too angry.  I can tell him anything and I know he will have my back.  He keeps things light with our team and he is very flexible.  I think he gives me a little more respect than the others on the team b/c I am most senior.
381,"My working relationship with my Leader is like the relationship between dog and cat. Sometimes, he behave like a Mentor and sometimes, he behave like he doesn't know me very well. As the concern regarding coaching and development, he did it well. He helpsme to improve my performance level a lot. Professionally, he behaves well in office , specially in front of my co-workers. But, when he meet me individually he treats me differently. My fellow co-workers relationship with my leader is same like me, I notied no such difference. But, yes few senior workers are there who have some different kind of understanding level."
382,"My leader is a total jackass and that is putting it mildly in a very polite way. He does not provide coaching or proper leadership to any of the workers. He shows very little respect towards the workers. He has workers that he considers his favorites, andeven with them he still happens to speak badly about them behind their back. Basically he is a two faced hypocrite that speaks badly about many workers and even other people in leadership positions. Many people are afraid of him because they do not want t be on his bad side because they know that he will be vengeful and purposefully retaliate in a bad way."
383,"My manager and I have a fairly good working relationship. His approach is rather hands off. He trusts and expects his employees to do their jobs and handle the day to day tasks of their jobs with having him have to babysit them. This is ok most of the tim but there are times when specific directions, guidance, and feedback would be helpful and appreciated. All in all it is a good working relationship, though it did take me some getting used to his management style. I can not really complain because I haveworked for far worse supervisors in the past."
384,"My supervisor is a very aloof individual working on the other side of the building from me.  He often does not give clear instructions and leaves me to find and manage my own work.  Our relationship has deteriorated since he brought on a new part time worer who works closely with him as an assistant.  He provides me with little coaching though he has given me tips on how to be a better supervisor since I stepped into a more managerial role.  My coworkers, who are all subordinate to me in the office, have ess close relationships with him."
385,"My team leader was a good combination of professionalism and the personal touch. Having risen from the entry-level of an employee, she knew most of the problems that employees faced. She was a good leader and had strong communication skills. She motivatedme to come up with new ideas and always provided helpful feedback. She always set, changed, evaluated and monitored our work goals to improve our bottom line and I learned a lot from him. Building and maintain good working relationships will not only makeyou more engaged and committed to your organization; it can also open doors to key projects, career advancement, and raises."
386,My leader gives me every opportunity to succeed.  They allow me to work on my own schedule and on projects of my choosing.  My leader shows appreciation verbally both individually and in a group.   My leader is this way with all of our employees.   My leaer often asks me how we can improve the company and what we can do to change it or make it better.  I am confident that my leader will always be willing to listen and take my thoughts and feelings in to consideration.  They give bonuses to show gratificaton of a job well done.
387,"I have a good working relationship with my supervisor.  He provides the coaching and development that I need, but does not overstep his bounds and micro manage my every move.  He behaves in a respectful manner, always asking nicely if I will do certain taks for him.  I think that my relationship with my leader is similar to my coworkers relationship with him, at least my coworkers that are on the same management level as me.  Overall, I like working for this supervisor more than I have anyone else, becaus he is willing to let me manage the program as I see fit."
388,Our leader is Idiot as per I know. He only requires people to work in time and complete the work as per schedule whatever the circumstances will occur. He is not pleasant at all. I felt unhappy whenever I see him around me at work. His attitude towards usis very disgusting. I am living the company on next month and i will definitely ask the leader about the growth of mine.
389,"My leader allows me to speak my piece when I see an issue or have a suggestion on how to make things run better.  She also gives me direction when I have trouble coming up with one on my own.  She is also open to what I need to do to progress further in m career and allows me the time to work on those goals.  Others find her difficult to work with as she is very blunt and can be unforgiving in her attitude, however I am able to maintain my peace.  When others are having difficulty talking with her, they wll come to me instead for advise."
390,My leader provides a moderate amount of coaching and development. It is adequate. My leader generally shows me a decent amount of respect. My leader has an equal relationship with my coworkers.  My leader provides a moderate amount of coaching and developent. It is adequate. My leader generally shows me a decent amount of respect. My leader has an equal relationship with my coworkers. My leader provides a moderate amount of coaching and development. It is adequate. My leader generally shows me a decent amunt of respect. My leader has an equal relationship with my coworkers.  My leader provides a moderate amount of coaching and development. It is adequate. My leader generally shows me a decent amount of respect. My leader has an equal relationship with my oworkers.
391,I am not entirely satisfied with my working relationship with my leader. I feel he does not provide enough coaching and development. He does not always show enough respect to me or my co-workers. He just treats us like slaves or robots sometimes. I am notentirely satisfied with my working relationship with my leader. I feel he does not provide enough coaching and development. He does not always show enough respect to me or my co-workers. He just treats us like slaves or robots sometimes.I am not entirely atisfied with my working relationship with my leader. I feel he does not provide enough coaching and development. He does not always show enough respect to me or my co-workers. He just treats us like slaves or robots sometimes.
392,My team leader is very good and very helpful he is solve my problem so he is very good he is very good on his work he know every thing his full confidence about his work.my leader is understand my problem and my situation he is very good on his work he gie me good tips about my work he is very good mind i am very happy work with my leader he is very helpful and he is follow his rule and he is very confortble with his work. i am very happy to work with my leader  he know everything
393,I really enjoy my working relationship with my direct supervisor. We have daily meetings every morning with our goals for the day and input on how to meet those goals so I believe she gives a decent amount of coaching. I know that I am respected because m supervisor treats me and an equal and always is open to my ideas and criticisms of how our team is running. I believe we all have very similar relationships with her. No one appears to receive any type of favoritism in our team. I feel that I am equal toboth my co-workers and supervisor.
394,"She doesn't provide a lot of guidance, but I don't exactly need to develop much further. She does let me know about opportunities for growth when they are available. She shows respect for me by not micromanaging, but by always offering to help when needed She gives me a lot of flexibility in terms of working from home or leaving early, as I have proven that I am reliable and will always finish my work. Most of my coworkers have a similar relationship with our manager, though the less reliable people are gven less flexibility and their work is much more closely monitored, where I am generally left alone until assistance is clearly needed."
395,I think I have a good working relationship with my leader.  She offers a lot of online training and one on one if needed.  My leader shows she respects me by asking my opinion on some decisions that have to be made at the site level.  My relationship withcoworkers is better than my relationship with my leader.  I can speak more freely with my coworkers and they are more receptive to my ideas.   I do feel like I can call my leader whenever I have a problem or question and she will help to resolve it.
396,My leader is more than willing to show you something if you don't know what you are doing. She makes it very comfortable to be able to go to her if you need help with anything. She shows every employee the same respect. She never shows favoritism. With ths being said is  so easy and comfortable to go to her when you need help.
397,My manager is a very tell vs ask kind of person. I find that he delegates good responsibilities to people including myself that aren't supposed to take on such tasks. He doesn't develop he just tells you what you've done wrong without guidance. I was surpised at that coming here. I thought this would be better in this company but I guess not. This surpassed me.
